{
  "$schema": "https://json-schema.org/draft/2020-12/schema",
  "$id": "https://retroarchivebox.invalid/schemas/malware-provider-capabilities-v1.json",
  "title": "AVBox capabilities response",
  "type": "object",
  "required": ["protocol_version", "provider_id", "instance_id", "profiles"],
  "properties": {"protocol_version": {"const": "1"}, "provider_id": {"type": "string"}, "instance_id": {"type": "string"}, "profiles": {"type": "object", "additionalProperties": {"type": "object", "required": ["available", "version", "representations"], "properties": {"available": {"type": "boolean"}, "version": {"type": "string"}, "representations": {"type": "array", "items": {"type": "string"}}, "reason": {"type": "string"}}, "additionalProperties": false}}},
  "additionalProperties": false
}
